fname,Ad_ID,Clicks,Impressions,Spend_RUB,Spend_USD,Create_Date,End_Date,Ad_Text,Ad_Landing_Page,Location,Age,Gender,Excluded_Connections,Language,Placements,People_Who_Match,Interests,Custom_Audience,txt_Clicks,txt_impressions,txt_spend,txt_create,txt_end
2015-06/P(1)0001844.pdf,79,0,31,33.59,0.6,2015-06-09,2015-06-11,?????? ??? ????? ???????????,https://www.facebook.com/pages/L-for-life/994910227187446,United States,18 - 65+,NA,Exclude people who like L for life,English (UK)or English (US),"News Feed on desktop computers, News Feed on  News Feed on desktop computers, News Feed on devices or Right column on desktop computers",NA,NA,NA,0,31,33.59 RUB,06/09/15 03:50:21 AM PDT,06/11/15 03:48:00 AM PDT
2015-06/P(1)0002143.pdf,356,3,162,18.1,0.33,2015-06-09,2015-06-10,Such a beautiful day! Such a beatiful view!,https://www.facebook.com/pages/L-for-life/994910227187446,United States,18 - 65+,NA,NA,NA,News Feed on desktop computers or News  News Feed on desktop computers or News devices,NA,Landscape painting or Landscape,NA,3,162,18.10 RUB,06/09/15 05:57:56 AM PDT,06/10/15 05:57:56 AM PDT
2015-06/P(1)0002263.pdf,430,0,0,0,0,2015-06-09,2015-06-10,NA,https://www.facebook.com/pages/L-for-life/994910227187446,United States,18 - 65+,NA,NA,NA,News Feed on desktop computers or News  News Feed on desktop computers or News devices,NA,NA,NA,0,0,None,06/09/15 03:48:26 AM PDT,06/10/15 03:48:25 AM PDT
2015-06/P(1)0000054.pdf,374,0,137,44.87,0.83,2015-06-10,NA,Join us because we care. Black matters.,https://www.facebook.com/Black-Matters-1579673598947501/,United States: Baltimore (+20 km) Maryland; St. Louis(+20 km) Missouri,18 - 65+,NA,Exclude people who like Black Matters,English (UK)or English (US),News Feed on desktop computers or News Feed on mobile  News Feed on desktop computers or News Feed on mobile devices,NA,NA,NA,0,137,44.87 RUB,06/10/15 02:59:53 AM PDT,NA
2015-06/P(1)0002111.pdf,325,4,326,45.94,0.85,2015-06-10,2015-06-11,"California...knows how to party California...knows how to party In the citaaay of L.A. In the citaaay of good of Watts In the citaaay, the city of Compton We keep it rockin! We keep it rockin! - 2Pac - California Love",https://www.facebook.com/Black-Matters-1579673598947501/,"United States: Baltimore Maryland; Ferguson, St. Louis Cleveland Ohio",18 - 65+,NA,NA,NA,News Feed on desktop computers or News Feed on  News Feed on desktop computers or News Feed on devices,NA,NA,NA,4,326,45.94 RUB,06/10/15 07:34:52 AM PDT,06/11/15 07:34:51 AM PDT
2015-06/P(1)0002145.pdf,357,12,559,85.25,1.57,2015-06-10,2015-06-11,"McKinney Police Officer Involved In Pool Party Incident Eric Casebolt, the McKinney, police officer who was caught on video pinning a teenage girl to the ground and pulling his gun on others at a pool party, has resigned Tuesday evening. The McKinney Police Department, Chief Of Police Greg Conley said that Casebolt's decision to leave was voluntary and that he would continue to collect a pension and benefits. Why are the police so aggressive? It's in every state around the country. The young girl at the pool party was treated horrible. Our society needs police, good police, people who will solve crimes but, unfortunately, today we need someone who will protect us from the police. At the same time, it is good that millions of regular people got a glimpse of what kind of policing minorities have endured for decades.",https://www.facebook.com/Black-Matters-1579673598947501/,"United States: Baltimore Maryland; Ferguson, St. Louis Missouri; Cleveland Ohio",18 - 65+,NA,NA,NA,News Feed on desktop computers or News Feed on mobile  News Feed on desktop computers or News Feed on mobile devices,NA,NA,NA,12,559,85.25 RUB,06/10/15 07:31:35 AM PDT,06/11/15 07:31:34 AM PDT
2015-06/P(1)0002146.pdf,358,45,635,94.04,1.73,2015-06-10,2015-06-11,"Say it loud - ""I am Black and I'm proud:""",https://www.facebook.com/Black-Matters-1579673598947501/,"United States: Baltimore Maryland: Ferguson, St. Louis Cleveland Ohio",18 - 65+,NA,NA,NA,News Feed on desktop computers or News Feed on  News Feed on desktop computers or News Feed on devices,NA,NA,NA,45,635,94.04 RUB,06/10/15 07:34:31 AM PDT,06/11/15 07:34:31 AM PDT
2015-06/P(1)0002148.pdf,360,0,0,0,0,2015-06-10,NA,Keeping eye on our brother's cases and much more,https://www.facebook.com/blackmattersus,United States: Baltimore (+20 km) Maryland; St. Louis(+20 km) Missouri,18 - 65+,NA,Exclude people who like Black Matters,English (UK)or English (US),News Feed on desktop computers or News Feed on mobile  News Feed on desktop computers or News Feed on mobile devices,NA,NA,NA,0,0,None,06/10/15 03:01:20 AM PDT,NA
2015-06/P(1)0002150.pdf,361,5,82,34.66,0.64,2015-06-10,NA,Keeping eye on our brother's cases and much more,https://www.facebook.com/blackmattersus/,United States: Baltimore (+20 km) Maryland; St. Louis(+20 km) Missouri,18 - 65+,NA,Exclude people who like Black Matters,English (UK)or English (US),News Feed on desktop computers or News Feed on mobile  News Feed on desktop computers or News Feed on mobile devices,NA,NA,NA,5,82,34.66 RUB,06/10/15 03:20:43 AM PDT,NA
2015-06/P(1)0002154.pdf,363,0,0,0,0,2015-06-10,NA,Keeping eye on our brother's cases and much more,https://www.facebook.com/blackmattersus,United States: Baltimore (+20 km) Maryland; St. Louis(+20 km) Missouri,18 - 65+,NA,Exclude people who like Black Matters,English (UK)or English (US),News Feed on desktop computers or News Feed on mobile  News Feed on desktop computers or News Feed on mobile devices,NA,NA,NA,0,0,None,06/10/15 03:01:20 AM PDT,NA
2015-06/P(1)0002156.pdf,364,2740,46447,12858.46,236.69,2015-06-10,NA,Keeping eye on our brother's cases and much more,https://www.facebook.com/blackmattersus/,United States: Baltimore (+20 km) Maryland; St. Louis(+20 km) Missouri,18 - 65+,NA,Exclude people who like Black Matters,English (UK)or English (US),News Feed on desktop computers or News Feed on mobile  News Feed on desktop computers or News Feed on mobile devices,NA,NA,NA,"2,740","46,447","12,858.46 RUB",06/10/15 03:29:48 AM PDT,NA
2015-06/P(1)0002160.pdf,366,0,158,50.11,0.92,2015-06-10,NA,Keeping eye on our brother's cases and much more,https://www.facebook.com/Black-Matters-1579673598947501/,United States: Baltimore (+20 km) Maryland; St. Louis(+20 km) Missouri,18 - 65+,NA,Exclude people who like Black Matters,English (UK)or English (US),News Feed on desktop computers or News Feed on mobile  News Feed on desktop computers or News Feed on mobile devices,NA,NA,NA,0,158,50.11 RUB,06/10/15 03:01:19 AM PDT,NA
2015-06/P(1)0002164.pdf,368,0,0,0,0,2015-06-10,NA,Join us because we care. Black matters.,https://www.facebook.com/blackmattersus,United States: Baltimore (+20 km) Maryland; St. Louis(+20 km) Missouri,18 - 65+,NA,Exclude people who like Black Matters,English (UK)or English (US),News Feed on desktop computers or News Feed on mobile  News Feed on desktop computers or News Feed on mobile devices,NA,NA,NA,0,0,None,06/10/15 02:59:59 AM PDT,NA
2015-06/P(1)0002166.pdf,369,3296,56408,13704.02,252.25,2015-06-10,NA,Join us because we care. Black matters.,https://www.facebook.com/Black-Matters-1579673598947501/,United States: Baltimore (+20 km) Maryland; St. Louis(+20 km) Missouri,18 - 65+,NA,Exclude people who like Black Matters,English (UK)or English (US),News Feed on desktop computers or News Feed on mobile  News Feed on desktop computers or News Feed on mobile devices,NA,NA,NA,"3,296","56,408","13,704.02 RUB",06/10/15 03:27:28 AM PDT,NA
2015-06/P(1)0002170.pdf,371,0,0,0,0,2015-06-10,NA,Join us because we care. Black matters.,https://www.facebook.com/blackmattersus,United States: Baltimore (+20 km) Maryland; St. Louis(+20 km) Missouri,18 - 65+,NA,Exclude people who like Black Matters,English (UK)or English (US),News Feed on desktop computers or News Feed on mobile  News Feed on desktop computers or News Feed on mobile devices,NA,NA,NA,0,0,None,06/10/15 02:59:57 AM PDT,NA
2015-06/P(1)0002172.pdf,372,1574,26442,7018.96,129.2,2015-06-10,NA,Join us because we care. Black matters.,https://www.facebook.com/Black-Matters-1579673598947501/,United States: Baltimore (+20 km) Maryland; St. Louis(+20 km) Missouri,18 - 65+,NA,Exclude people who like Black Matters,English (UK)or English (US),News Feed on desktop computers or News Feed on mobile  News Feed on desktop computers or News Feed on mobile devices,NA,NA,NA,"1,574","26,442","7,018.96 RUB",06/10/15 03:30:17 AM PDT,NA
2015-06/P(1)0002178.pdf,376,0,0,0,0,2015-06-10,NA,Your life matter.My life matter. Black matters.,https://www.facebook.com/blackmattersus,United States: Baltimore (+20 km) Maryland; St. Louis(+20 km) Missouri,18 - 65+,NA,Exclude people who like Black Matters,English (UK)or English (US),News Feed on desktop computers or News Feed on mobile  News Feed on desktop computers or News Feed on mobile devices,NA,NA,NA,0,0,None,06/10/15 02:58:57 AM PDT,NA
2015-06/P(1)0002180.pdf,377,7,249,85.63,1.58,2015-06-10,NA,Your life matter.My life matter. Black matters.,https://www.facebook.com/Black-Matters-1579673598947501/,United States: Baltimore (+20 km) Maryland; St. Louis(+20 km) Missouri,18 - 65+,NA,Exclude people who like Black Matters,English (UK)or English (US),News Feed on desktop computers or News Feed on mobile  News Feed on desktop computers or News Feed on mobile devices,NA,NA,NA,7,249,85.63 RUB,06/10/15 03:31:26 AM PDT,NA
2015-06/P(1)0002184.pdf,379,0,0,0,0,2015-06-10,NA,Your life matter.My life matter. Black matters.,https://www.facebook.com/blackmattersus,United States: Baltimore (+20 km) Maryland; St. Louis(+20 km) Missouri,18 - 65+,NA,Exclude people who like Black Matters,English (UK)or English (US),News Feed on desktop computers or News Feed on mobile  News Feed on desktop computers or News Feed on mobile devices,NA,NA,NA,0,0,None,06/10/15 02:58:56 AM PDT,NA
2015-06/P(1)0002186.pdf,380,7,207,69.56,1.28,2015-06-10,NA,Your life matter.My life matter. Black matters.,https://www.facebook.com/Black-Matters-1579673598947501/,United States: Baltimore (+20 km) Maryland; St. Louis(+20 km) Missouri,18 - 65+,NA,Exclude people who like Black Matters,English (UK)or English (US),News Feed on desktop computers or News Feed on mobile  News Feed on desktop computers or News Feed on mobile devices,NA,NA,NA,7,207,69.56 RUB,06/10/15 03:30:43 AM PDT,NA
2015-06/P(1)0002190.pdf,382,2,157,50.16,0.92,2015-06-10,NA,Your life matter.My life matter. Black matters.,https://www.facebook.com/Black-Matters-1579673598947501/,United States: Baltimore (+20 km) Maryland; St. Louis(+20 km) Missouri,18 - 65+,NA,Exclude people who like Black Matters,English (UK)or English (US),News Feed on desktop computers or News Feed on mobile  News Feed on desktop computers or News Feed on mobile devices,NA,NA,NA,2,157,50.16 RUB,06/10/15 02:58:54 AM PDT,NA
2015-06/P(1)0002194.pdf,384,0,0,0,0,2015-06-10,NA,We really can change the world if we stay united.,https://www.facebook.com/blackmattersus,United States: Baltimore (+20 km) Maryland; St. Louis(+20 km) Missouri,18 - 65+,NA,Exclude people who like Black Matters,English (UK)or English (US),News Feed on desktop computers or News Feed on mobile  News Feed on desktop computers or News Feed on mobile devices,NA,NA,NA,0,0,None,06/10/15 02:58:20 AM PDT,NA
2015-06/P(1)0002196.pdf,385,3,66,25.87,0.48,2015-06-10,NA,We really can change the world if we stay united.,https://www.facebook.com/Black-Matters-1579673598947501/,United States: Baltimore (+20 km) Maryland; St. Louis(+20 km) Missouri,18 - 65+,NA,Exclude people who like Black Matters,English (UK)or English (US),News Feed on desktop computers or News Feed on mobile  News Feed on desktop computers or News Feed on mobile devices,NA,NA,NA,3,66,25.87 RUB,06/10/15 03:28:34 AM PDT,NA
2015-06/P(1)0002200.pdf,387,0,0,0,0,2015-06-10,NA,We really can change the world if we stay united.,https://www.facebook.com/blackmattersus,United States: Baltimore (+20 km) Maryland; St. Louis(+20 km) Missouri,18 - 65+,NA,Exclude people who like Black Matters,English (UK)or English (US),News Feed on desktop computers or News Feed on mobile  News Feed on desktop computers or News Feed on mobile devices,NA,NA,NA,0,0,None,06/10/15 02:58:20 AM PDT,NA
2015-06/P(1)0002202.pdf,388,8,311,105.62,1.94,2015-06-10,NA,We really can change the world if we stay united.,https://www.facebook.com/Black-Matters-1579673598947501/,United States: Baltimore (+20 km) Maryland; St. Louis(+20 km) Missouri,18 - 65+,NA,Exclude people who like Black Matters,English (UK)or English (US),News Feed on desktop computers or News Feed on mobile  News Feed on desktop computers or News Feed on mobile devices,NA,NA,NA,8,311,105.62 RUB,06/10/15 03:21:09 AM PDT,NA
2015-06/P(1)0002206.pdf,390,4,204,65.61,1.21,2015-06-10,NA,We really can change the world if we stay united.,https://www.facebook.com/Black-Matters-1579673598947501/,United States: Baltimore (+20 km) Maryland; St. Louis(+20 km) Missouri,18 - 65+,NA,Exclude people who like Black Matters,English (UK)or English (US),News Feed on desktop computers or News Feed on mobile  News Feed on desktop computers or News Feed on mobile devices,NA,NA,NA,4,204,65.61 RUB,06/10/15 02:58:18 AM PDT,NA
2015-06/P(1)0002210.pdf,392,0,0,0,0,2015-06-10,NA,Black matters because everyone's life matters,https://www.facebook.com/blackmattersus,United States: Baltimore (+20 km) Maryland; St. Louis(+20 km) Missouri,18 - 65+,NA,Exclude people who like Black Matters,English (UK)or English (US),News Feed on desktop computers or News Feed on mobile  News Feed on desktop computers or News Feed on mobile devices,NA,NA,NA,0,0,None,06/10/15 02:58:03 AM PDT,NA
2015-06/P(1)0002212.pdf,393,2,191,56.53,1.04,2015-06-10,NA,Black matters because everyone's life matters,https://www.facebook.com/Black-Matters-1579673598947501/,United States: Baltimore (+20 km) Maryland; St. Louis(+20 km) Missouri,18 - 65+,NA,Exclude people who like Black Matters,English (UK)or English (US),News Feed on desktop computers or News Feed on mobile  News Feed on desktop computers or News Feed on mobile devices,NA,NA,NA,2,191,56.53 RUB,06/10/15 03:22:04 AM PDT,NA
2015-06/P(1)0002216.pdf,395,0,0,0,0,2015-06-10,NA,Black matters because everyone's life matters,https://www.facebook.com/blackmattersus,United States: Baltimore (+20 km) Maryland; St. Louis(+20 km) Missouri,18 - 65+,NA,Exclude people who like Black Matters,English (UK)or English (US),News Feed on desktop computers or News Feed on mobile  News Feed on desktop computers or News Feed on mobile devices,NA,NA,NA,0,0,None,06/10/15 02:58:01 AM PDT,NA
2015-06/P(1)0002218.pdf,396,7,250,83.22,1.53,2015-06-10,NA,Black matters because everyone's life matters,https://www.facebook.com/Black-Matters-1579673598947501/,United States: Baltimore (+20 km) Maryland; St. Louis(+20 km) Missouri,18 - 65+,NA,Exclude people who like Black Matters,English (UK)or English (US),News Feed on desktop computers or News Feed on mobile  News Feed on desktop computers or News Feed on mobile devices,NA,NA,NA,7,250,83.22 RUB,06/10/15 03:27:56 AM PDT,NA
2015-06/P(1)0002222.pdf,398,1,136,38.89,0.72,2015-06-10,NA,Black matters because everyone's life matters,https://www.facebook.com/Black-Matters-1579673598947501/,United States: Baltimore (+20 km) Maryland; St. Louis(+20 km) Missouri,18 - 65+,NA,Exclude people who like Black Matters,English (UK)or English (US),News Feed on desktop computers or News Feed on mobile  News Feed on desktop computers or News Feed on mobile devices,NA,NA,NA,1,136,38.89 RUB,06/10/15 02:58:00 AM PDT,NA
2015-06/P(1)0002226.pdf,400,0,0,0,0,2015-06-10,NA,We can be heard only when we stand together. Black matters.,https://www.facebook.com/blackmattersus,United States: Baltimore (+20 km) Maryland; St. Louis(+20 km) Missouri,18 - 65+,NA,Exclude people who like Black Matters,English (UK)or English (US),News Feed on desktop computers or News Feed on mobile  News Feed on desktop computers or News Feed on mobile devices,NA,NA,NA,0,0,None,06/10/15 02:57:12 AM PDT,NA
2015-06/P(1)0002228.pdf,401,4,203,74.07,1.36,2015-06-10,NA,We can be heard only when we stand together. Black matters.,https://www.facebook.com/Black-Matters-1579673598947501/,United States: Baltimore (+20 km) Maryland; St. Louis(+20 km) Missouri,18 - 65+,NA,Exclude people who like Black Matters,English (UK)or English (US),News Feed on desktop computers or News Feed on mobile  News Feed on desktop computers or News Feed on mobile devices,NA,NA,NA,4,203,74.07 RUB,06/10/15 03:26:57 AM PDT,NA
2015-06/P(1)0002232.pdf,403,0,0,0,0,2015-06-10,NA,We can be heard only when we stand together. Black matters.,https://www.facebook.com/blackmattersus,United States: Baltimore (+20 km) Maryland; St. Louis(+20 km) Missouri,18 - 65+,NA,Exclude people who like Black Matters,English (UK)or English (US),News Feed on desktop computers or News Feed on mobile  News Feed on desktop computers or News Feed on mobile devices,NA,NA,NA,0,0,None,06/10/15 02:57:12 AM PDT,NA
2015-06/P(1)0002234.pdf,404,6,248,77.74,1.43,2015-06-10,NA,We can be heard only when we stand together. Black matters.,https://www.facebook.com/Black-Matters-1579673598947501/,United States: Baltimore (+20 km) Maryland; St. Louis(+20 km) Missouri,18 - 65+,NA,Exclude people who like Black Matters,English (UK)or English (US),News Feed on desktop computers or News Feed on mobile  News Feed on desktop computers or News Feed on mobile devices,NA,NA,NA,6,248,77.74 RUB,06/10/15 03:21:36 AM PDT,NA
2015-06/P(1)0002238.pdf,406,1,160,45.72,0.84,2015-06-10,NA,We can be heard only when we stand together. Black matters.,https://www.facebook.com/Black-Matters-1579673598947501/,United States: Baltimore (+20 km) Maryland; St. Louis(+20 km) Missouri,18 - 65+,NA,Exclude people who like Black Matters,English (UK)or English (US),News Feed on desktop computers or News Feed on mobile  News Feed on desktop computers or News Feed on mobile devices,NA,NA,NA,1,160,45.72 RUB,06/10/15 02:57:10 AM PDT,NA
2015-06/P(1)0002112.pdf,326,517,1478,99.97,1.83,2015-06-11,2015-06-12,"Since 2010, over 350 of our lives have been taken at the hands of police. Those lives of which, were made to be worthless because of our race. Each time we die, many of your people, and those who stand by you, justify the taking of our lives, because they believe we are not human, and are not worthy of life. Why should we be a target for police violence and harassment?",https://www.facebook.com/Black-Matters-1579673598947501/,"United States Baltimore Maryland: Ferguson, St. Louis Missouri; Cleveland Ohio",18 - 65+,NA,NA,NA,News Feed on desktop computers or News Feed on mobile  News Feed on desktop computers or News Feed on mobile devices,NA,NA,NA,517,1.478,99.97 RUB,06/11/15 0113:16 AM PDT,06/12/15 03:13:16 AM PDT
2015-06/P(1)0002113.pdf,327,7,125,34.77,0.63,2015-06-11,2015-06-12,"'Just like Trayvon Martin, race mattered for Amadou Diallo, Oscar Grant, Sean Bell, Emmett Till, and [thousands] more we will never know the name of who died because of their skin color."" - Angela Davis. Racism is still alive in the USA.",https://www.facebook.com/Black-Matters-1579673598947501/,"United States: Baltimore Maryland; Ferguson, St. Louis Missouri; Cleveland Ohio",18 - 65+,NA,NA,NA,News Feed on desktop computers or News Feed on mobile  News Feed on desktop computers or News Feed on mobile devices,NA,NA,NA,7,125,34.77 RUB,06/11/15 06:51:30 AM PDT,06/12/15 06:51:29 AM PDT
2015-06/P(1)0002114.pdf,328,17,168,31.54,0.58,2015-06-11,2015-06-12,"Race war started by Texas teacher A Texas fourth-grade teacher Karen Fitzgibbons published a racial Facebook post in which she confirmed that Black people are responsible for racial tensions in the USA. Moreover she claimed that she is ""almost to the point"" of defending the segregation. After her post about the recent pool party incident drew local attention, the teacher deleted her profile. ""This makes me ANGRY! This officer should not have had to resign. I'm going to just go ahead and say it....the blacks are the ones causing the problems and this `racial tension. I guess that's what happens when you flunk out of school and have no education. I'm sure their parents are just as guilty for not knowing what their kids were doing; or knew it and didn't care,"" she wrote. She also added,""I'm almost to the point of wanting them all segregated on one side of town so they can hurt each other and leave the innocent people alone. Maybe the 50s and 60s were really on to something. Now, let the bashing of my true and honest opinion begin....GO!#imnotracist #imsickofthemcausingtrouble #itwasagatedcommunity"". As we see Karen Fitzgibbons is a real racist, who approves the humiliation of black people! This news clearly reflects that American society is close to collapse, if not to say to war. As the authorities are doing nothing to resolve the situation, in the near future we may face real race war within our country.",https://www.facebook.com/Black-Matters-1579673598947501/,"United States: Baltimore Maryland; Ferguson, St. Louis Missouri; Cleveland Ohio",18 - 65+,NA,NA,NA,News Feed on desktop computers or News Feed on mobile  News Feed on desktop computers or News Feed on mobile devices,NA,NA,NA,17,168,31.54 RUB,06/11/15 07:03:58 AM PDT,06/12/15 07:03:57 AM PDT
2015-06/P(1)0002115.pdf,329,18,482,90.65,1.66,2015-06-15,2015-06-16,"The image of 1938 shows several African American Youths dangling around the stairs leading up to the back entrance of a segregated movie theater in Anniston, Alabama.That day the Tarzan film, Call of the Savage was shown.",https://www.facebook.com/Black-Matters-1579673598947501/,"United States: Baltimore Maryland; Ferguson, St. Louis Missouri; Cleveland Ohio",18 - 65+,NA,NA,NA,News Feed on desktop computers or News Feed on mobile  News Feed on desktop computers or News Feed on mobile devices," People who like Black Matters, Friends of connections: Friends of people who are connected to Black Matters",NA,NA,18,482,90.65 RUB,06/15/15 07:21:33 AM PDT,06/16/15 07:21:33 AM PDT
2015-06/P(1)0002116.pdf,330,24,524,88.45,1.62,2015-06-15,2015-06-16,"American Racists On The Road The racists group of America ""Back To The Blue"" are organizing a hate rally in response to the public outcry and protests against police officers. ""Bikers-patriots"" want to descend on the McKinney Police HQ in a show of solidarity for the police because race-baiters and cop-haters. They plan to have ""the biggest thing to happen in Patriot Movement since the Bundy Ranch victory!"" It seems like we won't get into ""post-racial America"".... this event and the regular murder of innocent Black children by white supremacist police and citizens makes that clear. The modern government has brought racist America to the forefront, good or bad. This is something that America has a serious issue with - RACISM! Is it time to call out the national guard?",https://www.facebook.com/Black-Matters-1579673598947501/,"United States: Baltimore Maryland; Ferguson, St. Louis Missouri; Cleveland Ohio",18 - 65+,NA,NA,NA,News Feed on desktop computers or News Feed on mobile  News Feed on desktop computers or News Feed on mobile devices," People who like Black Matters, Friends of connections: Friends of people who are connected to Black Matters",NA,NA,24,524,88.45 RUB,06/15/15 07:22:00 AM PDT,06/16/15 07:21:59 AM PDT
2015-06/P(1)0002117.pdf,331,43,764,90.86,1.67,2015-06-15,2015-06-16,"""Free Figure's Black Power Rally at VCU:""",https://www.facebook.com/Black-Matters-1579673598947501/,"United States: Baltimore Maryland: Ferguson, St. Louis Cleveland Ohio",18 - 65+,NA,NA,NA,News Feed on desktop computers or News Feed on  News Feed on desktop computers or News Feed on devices,NA,NA,NA,43,764,90.86 RUB,06/15/15 07:21:47 AM PDT,06/16/15 07:21:47 AM PDT
2015-06/P(1)0002118.pdf,332,47,676,89.51,1.64,2015-06-15,2015-06-16,"A woman pretended Afro-American to gain control over black community association The president of a local NAACP chapter in Spokane, Washington is under investigation after her parents publicly accused her of lying being African American. Both parents of Rachel Dolezal are white. Rachel Dolezal also serves as the chair of Spokane's Office of Police Ombudsman Commission and is an adjunct professor of Africana Studies at Eastern Washington University. Dolezal falsely identified herself as African-American in order to be appointed as a chair. Dolezal's parents paid attention to the official documents, including a birth certificate, confirming that Rachel is part Swedish, Czech, and German with ""traces"" of Native American heritage. We see, how whites are trying to gain control over traditionally black organization that protects the rights and interests of the black community. In the Dolezal's case it is unlikely it was a mistake or personally motivated fraud. Simply she was given a task to join the association of black community in order to control it and hold the interests of white majority. We need a deep inspection of Rachel Dolezal's activities while she was a president of the local branch of the Association of black people! In order not to repeat similar cases in future we need a careful control of all appointments by black community! As it is, there is a dominance of whites in police departments and authorities of cities with a predominantly black population!",https://www.facebook.com/Black-Matters-1579673598947501/,"United States: Baltimore Maryland; Ferguson, St. Louis Missouri; Cleveland Ohio",18 - 65+,NA,NA,NA,News Feed on desktop computers or News Feed on mobile  News Feed on desktop computers or News Feed on mobile devices,NA,NA,NA,47,676,89.51 RUB,06/15/15 07:22:20 AM PDT,06/16/15 07:22:20 AM PDT
2015-06/P(1)0002119.pdf,333,47,1075,174.4,3.25,2015-06-16,2015-06-17,"2Pac believed in Fight Tupac Shakur was indeed not just one of the greatest rappers of all time but a worldly icon whose status in hip-hop culture can never be replaced. His revolutionary knowledge mixed with street experience made him powerful unstoppable force that spoke to the hearts of millions of people. His songs touch on a number of engaging topics, including religion, women, oppression, etc. 2Pac was a humanitarian, who stood up for those who couldn't stand up for themselves. He believed in Fight and Speaking the Truth. Nowadays a lot of singers, both black and white use their music to sell records, just for making money. American society at all levels became too corruptive, starting from our government and ending with ordinary citizens. On the contrary Tupac did his music to influence the world. That's why he spoke to issues of poverty, oppression and racism. Today young African-Americans have fallen under bad influence of money, drugs and so on. Yeah, it is all started from the government's attitude towards Blacks. But let's remember Tupac and his ability to question the social order. Changes, one of his popular songs, asks everyone to change their lifestyles for better society. He always asked people to share with each other and to learn to love each other.",https://www.facebook.com/Black-Matters-1579673598947501/,"United States: Baltimore Maryland; Ferguson, St. Louis Missouri; Cleveland Ohio",18 - 65+,NA,NA,NA,News Feed on desktop computers or News Feed on mobile  News Feed on desktop computers or News Feed on mobile devices,NA,NA,NA,47,"1,075",174.40 RUB,06/16/15 07:36:57 AM PDT,06/17/15 07:36:56 AM PDT
2015-06/P(1)0002120.pdf,334,10,153,90.07,1.68,2015-06-16,2015-06-17,"Today we celebrate the legendary rapper who ever lived: Happy B-day, Tupac! The greatest of all time rapper is known not only for his music but for the wise words he spoke and his strength in standing up against oppression. His real name was Lesane Parish Crooks. Shakur was only 25 years old at the time he was shot and killed in 1996. His killer has never been caught. We will never forget 2Pac. Today we remember him on what would've been his 44th Birthday.",https://www.facebook.com/Black-Matters-1579673598947501/,"United States: Baltimore Maryland: Ferguson, St. Louis Missouri; Cleveland Ohio",18 - 65+,NA,NA,NA,News Feed on desktop computers or News Feed on mobile  News Feed on desktop computers or News Feed on mobile devices, People who like Black Matters. Friends of connections: Friends of people who are connected to Black Matters,NA,NA,10,153,90.07 RUB,06/16/15 07:37:14 AM PDT,06/17/15 07:37:13 AM PDT
2015-06/P(1)0002121.pdf,335,26,476,84.15,1.57,2015-06-16,2015-06-17,It is an American history. African-American citizens sat behind on city buses.,https://www.facebook.com/Black-Matters-1579673598947501/,"United States: Baltimore Maryland; Ferguson, St. Louis Cleveland Ohio",18 - 65+,NA,NA,NA,News Feed on desktop computers or News Feed on  News Feed on desktop computers or News Feed on devices,NA,NA,NA,26,476,84.15 RUB,06/16/15 08:20:31 AM PDT,06/17/15 08:20:30 AM PDT
2015-06/P(1)0002468.pdf,580,103,122,129.66,2.42,2015-06-16,NA,We speak for all fellow members of LGBT community across the nation.,https://www.facebook.com/Igbtun/,United States,18 - 65+,NA,Exclude people who like LGBT United,English (UK)or English (US),News Feed on desktop computers or News Feed on mobile  News Feed on desktop computers or News Feed on mobile devices,NA,LGBT community or Homosexuality,NA,103,122,129.66 RUB,06/16/15 03:36:10 AM PDT,NA
2015-06/P(1)0002596.pdf,668,0,0,0,0,2015-06-16,NA,We speak for all fellow members of LGBT community across the nation.,https://www.facebook.com/LGBT-United-839497472793277/,United States,18 - 65+,NA,Exclude people who like LGBT United,English (UK)or English (US),News Feed on desktop computers or News Feed on mobile  News Feed on desktop computers or News Feed on mobile devices,NA,LGBT community or Homosexuality,NA,0,0,None,06/16/15 03:36:09 AM PDT,NA
2015-06/P(1)0002122.pdf,336,42,745,175.37,3.24,2015-06-17,2015-06-18,Americans so much effort to hate each other instead of putting the effort into doing something useful. Stop racism! We all belong to ONE HUMAN RACE.,https://www.facebook.com/Black-Matters-1579673598947501/,"United States: Baltimore Maryland: Ferguson, St. Louis Missouri: Cleveland Ohio",18 - 65+,NA,NA,NA,News Feed on desktop computers or News Feed on mobile  News Feed on desktop computers or News Feed on mobile devices, People who like Black Matters. Friends of connections: Friends of people who are connected to Black Matters,NA,NA,42,745,175.37 RUB,06/17/15 07:41:34 AM PDT,06/18/15 07:41:33 AM PDT
2015-06/P(1)0002123.pdf,337,23,746,175.31,3.24,2015-06-17,2015-06-18,"No national outrage for an incident at pool party where a black teen was shot to death Today, the pool party in Georgia is even more shocking than a recent pool party in Texas. A young man from Georgia was shot to death at a pool party at Fayette. It was an advertised on social 200 teenager's pool party which ended up with shootings of unknown assailant for unknown reasons. One of the five injured, a 19-year-old black teenager Clanton passed away on the way to hospital. In fact, the media has not made a transparent effort to cover up the incident. Why the pool party in Georgia is a silent story? Why the police was not aware of a large party? Why this story has no national outrage? Is it ok when a black teenager dies? Unfortunately, the responding police officers were not able to prevent the tragedy. From these facts one might conclude, police officers know the easiest ways to arrest people, but they are irresponsible to avoid the shootings at the average pool party.",https://www.facebook.com/Black-Matters-1579673598947501/,"United States: Baltimore Maryland; Ferguson, St. Louis Missouri; Cleveland Ohio",18 - 65+,NA,NA,NA,News Feed on desktop computers or News Feed on mobile  News Feed on desktop computers or News Feed on mobile devices," People who like Black Matters, Friends of connections: Friends of people who are connected to Black Matters",NA,NA,23,746,175.31 RUB,06/17/15 07:41:07 AM PDT,06/18/15 07:41:06 AM PDT
2015-06/P(1)0002124.pdf,338,97,1290,270.36,4.99,2015-06-17,2015-06-18,"A 13-year-old child was tasered by cop for skateboarding A San Diego sheriff's deputy was filmed tasering 13-year-old child in the spine for skateboarding. Witnesses reported that the cop tried to force them to delete videos from their phones. Videos show how the child writhes in agony from being tased. Police said that the child ran away from home and was missing for a day-and-half. However it doesn't give the reason to taser a child. We see another case of police misconduct, when the policeman actually attacked the child. This case should reach the court, because the child hasn't done anything unlawful. The policeman exceeded his powers and used force against a child. So he should be punished. Before the trial nothing's gonna change and cops are about to do whatever they want. The task of all Americans who have witnessed police brutality is to extend all the information about it in order to reach out the government and the court.",https://www.facebook.com/Black-Matters-1579673598947501/,"United States: Baltimore Maryland; Ferguson, St. Louis Missouri; Cleveland Ohio",18 - 65+,NA,NA,NA,News Feed on desktop computers or News Feed on mobile  News Feed on desktop computers or News Feed on mobile devices," People who like Black Matters, Friends of connections: Friends of people who are connected to Black Matters",NA,NA,97,"1,290",270.36 RUB,06/17/15 07:41:46 AM PDT,06/18/15 07:41:45 AM PDT
2015-06/P(1)0002125.pdf,339,55,1005,248.56,4.59,2015-06-17,2015-06-18,"Only 9 days this year nobody was killed by police According to data from Mapping Police Violence there are only 9 days this calendar year when nobody was killed by police in the USA. Since January 1, 2015 at least 508 people have now been killed by policemen. Moreover, analyzing all deaths caused by police, African-American and Hispanic people are more likely to be killed than Whites. Figures show that the index of deaths for black people is 3.45 per million, while for whites it is 1.26 per million. Add here military-style equipment and non-lethal weapons, given to cops. And only 0.02 per cent of the nation's police forces are investigated each year. Only 0.02! That means, US policemen are immune from criminal changes in their killings. That's why they carry out their daily police raids to destroy the population at the territories under their control.",https://www.facebook.com/Black-Matters-1579673598947501/,"United States: Baltimore Maryland; Ferguson, St. Louis Missouri; Cleveland Ohio",18 - 65+,NA,NA,NA,News Feed on desktop computers or News Feed on mobile  News Feed on desktop computers or News Feed on mobile devices," People who like Black Matters, Friends of connections: Friends of people who are connected to Black Matters",NA,NA,55,"1,005",248.56 RUB,06/17/15 07:42:02 AM PDT,06/18/15 07:42:01 AM PDT
2015-06/P(1)0002126.pdf,340,21,844,169.47,3.13,2015-06-17,2015-06-18,"In early 1900s this Black Americana Chocolate Eyes Ad Art was popular in the USA. They made money from our pain and suffering! Though today we don't see such ads, racism still exists in the American society.",https://www.facebook.com/Black-Matters-1579673598947501/,"United States: Baltimore Maryland; Ferguson, St. Louis Missouri; Cleveland Ohio",18 - 65+,NA,NA,NA,News Feed on desktop computers or News Feed on mobile  News Feed on desktop computers or News Feed on mobile devices,NA,NA,NA,21,844,169.47 RUB,06/17/15 07:45:33 AM PDT,06/18/15 07:45:32 AM PDT
2015-06/P(1)0002470.pdf,581,36,1438,1362.57,25.15,2015-06-17,NA,We speak for all fellow members of LGBT community across the nation.,https://www.facebook.com/Igbtun/,United States,18 - 65+,NA,Exclude people who like LGBT United,English (UK)or English (US),News Feed on desktop computers or News Feed on mobile  News Feed on desktop computers or News Feed on mobile devices,NA,"LGBT community, Homosexuality, Yoga, Fitness and wellness or Politics and social issues",NA,36,"1,438","1,362.57 RUB",06/17/15 03:15:18 AM PDT,NA
2015-06/P(1)0002598.pdf,669,91,1997,2673.94,49.36,2015-06-17,NA,We speak for all fellow members of LGBT community across the nation.,https://www.facebook.com/LGBT-United-839497472793277/,United States,18 - 65+,NA,Exclude people who like LGBT United,English (UK)or English (US),News Feed on desktop computers or News Feed on mobile  News Feed on desktop computers or News Feed on mobile devices,NA,"LGBT community, Homosexuality, Yoga, Fitness and wellness or Politics and social issues",NA,91,"1,997","2,673.94 RUB",06/17/15 03:15:18 AM PDT,NA
2015-06/P(1)0002127.pdf,341,274,5072,1295.48,24.29,2015-06-18,2015-06-19,"Sadness and shocking tragedy at historically black church in Charlestone *CLICK TO GET LIVE UPDATES ON OUR PAGE* A white gunman opened a fire at pastor and 8 other church members at black church in Charlestone, S.0 on Wednesday night. The young clean-shaved shooter walked in during a prayer meeting and started shooting the people. Charleston Police Chief Greg Mullen said that the incident would be investigated as hate crime. Emanuel AME Church is a historically Africa-American church which was found by Denmark Vesey in order to organize a slave revolt in 1822. Despite the first black American president, Africa-Americans remain the most common victims of hate crimes. But what if the hate crime relates to xenophobia? American xenophobia is based on the dominant white heritage that is giving birth to another form of hate and discrimination. These forms take another level of hate. Unfortunately, American tolerance is not what we think it is. US public is swapping patriotism for nationalism, tolerance for Islamophobia, racism and anti-immigrant sentiment. For instance, last February American gunman killed three young Muslims two miles away from the University of North Carolina campus. Was this gunman motivated by hate and intolerance? Should we expect for more hate-crimes? What if American racial change still occurs through generations? What of it racism happens due to unequal opportunities? What if America is still a deeply racist country? What if the church is not a safe place anymore? #CharlestonShooting #chsnews",https://www.facebook.com/Black-Matters-1579673598947501/,"United States: Baltimore Maryland; Ferguson, St. Louis Missouri; Cleveland Ohio",18 - 65+,NA,NA,NA,News Feed on desktop computers or News Feed on mobile  News Feed on desktop computers or News Feed on mobile devices," People who like Black Matters, Friends of connections: Friends of people who are connected to Black Matters",NA,NA,274,"5,072","1,295.48 RUB",06/18/15 04:36:59 AM PDT,06/19/15 04:36:59 AM PDT
2015-06/P(1)0002128.pdf,342,46,866,199.94,3.75,2015-06-18,2015-06-19,"Rachel Dolezal is wearing the other persons shoes. Rachel Dolezal drew attention to her racial identification. A white-born former NAACP leader claimed to be black. The criticism towards Dolezal stems controversy around her identity and her position as the president of the NAACP in Washington. Today. Dolezal sees herself as first transracial. Rachel Dolezal stated that her racial identity was black, American Indian; white and two more races. Moreover if she proves that she is black; than anyone else will be able to prove that he/she is not even a human being. What do you think about her? What kind of rights should she have?",https://www.facebook.com/Black-Matters-1579673598947501/,"United States: Baltimore Maryland: Ferguson, St. Louis Missouri; Cleveland Ohio",18 - 65+,NA,NA,NA,News Feed on desktop computers or News Feed on mobile  News Feed on desktop computers or News Feed on mobile devices, People who like Black Matters. Friends of connections: Friends of people who are connected to Black Matters,NA,NA,46,866,199.94 RUB,06/18/15 02:50:25 AM PDT,06/19/15 02:50:24 AM PDT
2015-06/P(1)0002129.pdf,343,31,441,91.73,1.72,2015-06-18,2015-06-19,"The violent pool story #3. White police officer slammed black teen against his car This black family from Ohio will never forget the June 9th. According to the family's testimony, Krystal Dixon and her sister Maya Dixon took their eight children, nephews and nieces to Ohio public school in a Fairfield. Nevertheless, the pool employee demanded the family to leave due to one of the children did not have swim trunks. One of the boys broke the rules and the staff asked the family to leave. As six-months pregnant Krystal Dixon walked to the parking lot, the police officer grabbed her arm and asked for an ID-card. The witness video shows how the police officer pepper sprayed Dixon's family and grabbed 12-year-old child by neck. But according to the Fairfield police department, the white police officer did not use excessive force. Did the pool staff force them to leave because they were black? Was it a race factor? Don't you think the police officer's attempt to arrest Krystal Dixon was unlawful? How the police officers should be charged? What kind of right of defense do you have against unlawful arrests? These days, there is far more to being a ""good cop"" than choosing not to hurt innocent people. Plus, when are we going to stop being stereotypical? Even today, the stereotypes effect black population of the United States of America transmitted through music, lyrics, titles, literature, movies and folk saying. White Americans across the country embrace African-Americans the image of criminals and looters. How are we going to live with that?",https://www.facebook.com/Black-Matters-1 579673598947501/,"United States: Baltimore Maryland; Ferguson, St. Louis Missouri; Cleveland Ohio",18 - 65+,NA,NA,NA,News Feed on desktop computers or News Feed on mobile  News Feed on desktop computers or News Feed on mobile devices," People who like Black Matters, Friends of connections: Friends of people who are connected to Black Matters",NA,NA,31,441,91.73 RUB,06/18/15 07:21:41 AM PDT,06/19/15 07:21:41 AM PDT
2015-06/P(1)0002262.pdf,429,0,0,0,0,2015-06-18,2015-06-19,"Sadness and shocking tragedy at historically black church in Charlestone A white gunman opened a fire at pastor and 8 other church members at black church in Charlestone, S.0 on Wednesday night. The young clean-shaved shooter walked in during a prayer meeting and started shooting the people. Charleston Police Chief Greg Mullen said that the incident would be investigated as hate crime. Emanuel AME Church is a historically Africa-American church which was found by Denmark Vesey in order to organize a slave revolt in 1822. Despite the first black American president, Africa-Americans remain the most common victims of hate crimes. But what if the hate crime relates to xenophobia? American xenophobia is based on the dominant white heritage that is giving birth to another form of hate and discrimination. These forms take another level of hate. Unfortunately, American tolerance is not what we think it is. US public is swapping patriotism for nationalism, tolerance for Islamophobia, racism and anti-immigrant sentiment. For instance, last February American gunman killed three young Muslims two miles away from the University of North Carolina campus. Was this gunman motivated by hate and intolerance? Should we expect for more hate-crimes? What if American racial change still occurs through generations? What of it racism happens due to unequal opportunities? What if America is still a deeply racist country? What if the church is not a safe place anymore?",https://www.facebook.com/Black-Matters-1579673598947501/,"United States: Baltimore Maryland; Ferguson, St. Louis Missouri; Cleveland Ohio",18 - 65+,NA,NA,NA,News Feed on desktop computers or News Feed on mobile  News Feed on desktop computers or News Feed on mobile devices," People who like Black Matters, Friends of connections: Friends of people who are connected to Black Matters",NA,NA,0,0,None,06/18/15 02:49:23 AM PDT,06/19/15 02:49:23 AM PDT
2015-06/P(1)0002472.pdf,582,1724,18891,10085.77,189.09,2015-06-18,NA,We speak for all fellow members of LGBT community across the nation.,https://www.facebook.com/Igbtun/,United States,18 - 65+,NA,Exclude people who like LGBT United,English (UK)or English (US),News Feed on desktop computers or News Feed on mobile  News Feed on desktop computers or News Feed on mobile devices,NA,LGBT community or Homosexuality,NA,"1,724","18,891","10,085.77 RUB",06/18/15 12:58:48 AM PDT,NA
2015-06/P(1)0002600.pdf,670,0,0,0,0,2015-06-18,NA,We speak for all fellow members of LGBT community across the nation.,https://www.facebook.com/LGBT-United-839497472793277/,United States,18 - 65+,NA,Exclude people who like LGBT United,English (UK)or English (US),News Feed on desktop computers or News Feed on mobile  News Feed on desktop computers or News Feed on mobile devices,NA,LGBT community or Homosexuality,NA,0,0,None,06/18/15 12:58:48 AM PDT,NA
2015-06/P(1)0002602.pdf,671,0,0,0,0,2015-06-18,NA,"New LGBT community. Everyday news, updates, coming outs and much more!",https://www.facebook.com/LGBT-United-839497472793277/,United States,18 - 65+,NA,Exclude people who like LGBT United,English (UK)or English (US),News Feed on desktop computers or News Feed on mobile  News Feed on desktop computers or News Feed on mobile devices,NA,"LGBT community, Homosexuality, Yoga, Fitness and wellness or Politics and social issues",NA,0,0,None,06/18/15 12:57:19 AM PDT,NA
2015-06/P(1)0002604.pdf,672,12,115,206.25,3.87,2015-06-18,NA,"New LGBT community. Everyday news, updates, coming more!",https://www.facebook.com/LGBT-United-839497472793277/,United States,18 - 65+,NA,Exclude people who like,English (UK)or English (US),News Feed on desktop computers or  News Feed on desktop computers or devices,NA,LGBT community or Homosexuality,NA,12,115,206.25 RUB,06/18/15 12:58:48 AM PDT,NA
2015-06/P(1)0002608.pdf,674,0,0,0,0,2015-06-18,NA,"Everyday news, updates, coming outs and much more! United we stand!",https://www.facebook.com/LGBT-United-839497472793277/,United States,18 - 65+,NA,Exclude people who like LGBT United,English (UK)or English (US),News Feed on desktop computers or News Feed on mobile  News Feed on desktop computers or News Feed on mobile devices,NA,"LGBT community, Homosexuality, Yoga, Fitness and wellness or Politics and social issues",NA,0,0,None,06/18/15 12:57:58 AM PDT,NA
2015-06/P(1)0002610.pdf,675,4,59,102.75,1.93,2015-06-18,NA,"Everyday news, updates, coming outs and much more!",https://www.facebook.com/LGBT-United-839497472793277/,United States,18 - 65+,NA,Exclude people who like,English (UK)or English (US),News Feed on desktop computers or  News Feed on desktop computers or devices,NA,LGBT community or Homosexuality,NA,4,59,102.75 RUB,06/18/15 12:58:48 AM PDT,NA
2015-06/P(1)0002474.pdf,583,186,4265,1393.55,25.93,2015-06-22,NA,We speak for all fellow members of LGBT community across the nation.,https://www.facebook.com/Igbtun/,United States,18 - 65+,NA,Exclude people who like LGBT United,English (UK)or English (US),News Feed on desktop computers or News Feed on mobile  News Feed on desktop computers or News Feed on mobile devices,NA,"Motherhood, LGBT community, Indiana, Homosexuality or Love",NA,186,"4,265","1,393.55 RUB",06/22/15 08:19:07 AM PDT,NA
2015-06/P(1)0002606.pdf,673,0,0,0,0,2015-06-22,NA,We speak for all fellow members of LGBT community across the nation. Gender preference does not define you. Your spirit defines you.,https://www.facebook.com/LGBT-United-839497472793277/,United States,18 - 65+,NA,Exclude people who like LGBT United,English (UK)or English (US),News Feed on desktop computers or News Feed on mobile  News Feed on desktop computers or News Feed on mobile devices,NA,"Motherhood, LGBT community, Indiana, Homosexuality or Love",NA,0,0,None,06/22/15 08:19:07 AM PDT,NA
2015-06/P(1)0002612.pdf,676,0,0,0,0,2015-06-22,NA,We speak for all fellow members of LGBT community across the nation. Gender preference does not define you. Your spirit defines you.,https://www.facebook.com/LGBT-United-839497472793277/,United States,18 - 65+,NA,Exclude people who like LGBT United,English (UK)or English (US),News Feed on desktop computers or News Feed on mobile  News Feed on desktop computers or News Feed on mobile devices,NA,"Motherhood, LGBT community, Indiana, Homosexuality or Love",NA,0,0,None,06/22/15 08:19:07 AM PDT,NA
2015-06/P(1)0005957.pdf,3394,0,0,0,0,2015-06-22,NA,We speak for all fellow members of LGBT community across the nation. Gender preference does not define you. Your spirit defines you.,https://www.facebook.com/LGBT-United-839497472793277/,United States,18 - 65+,NA,Exclude people who like LGBT United,English (UK)or English (US),News Feed on desktop computers or News Feed on mobile  News Feed on desktop computers or News Feed on mobile devices,NA,"Motherhood, LGBT community, Indiana, Homosexuality or Love",NA,0,0,None,06/22/15 08:19:07 AM PDT,NA
2015-06/P(1)0000180.pdf,655,35,452,184.81,3.41,2015-06-23,2015-06-24,"NOT EVERY BOY WANTS TO BE A SOLDIER. A beautiful message was seen on the streets of the capitol,. with no group name or credits attached to the project. It was the poster at top, of the bearded man in a pink gown behaving like a queen and holding a sign saying ""Not every boy wants to be a soldier"". A timely message for today. The two recent U.S. wars were costly for our nation; to put it lightly. They led to domestic devastation of country. No matter what Defense Secretary or POTUS are saying they don't fool me with promises of gay military equality as key to the nation's agenda. Better talk to me about cutting DoD's budget. FOLKS. #Igbt #USarmy #CrossDress #GaySoldier #Obama #DefenseBudget #StopWar",https://www.facebook.com/LGBT-United-839497472793277/,United States,18 - 65+,NA,NA,NA,News Feed on desktop computers or News Feed on mobile  News Feed on desktop computers or News Feed on mobile devices," People who like LGBT United, Friends of connections: Friends of people who are connected to LGBT United",NA,NA,35,452,184.81 RUB,06/23/15 07:04:01 AM PDT,06/24/15 07:04:00 AM PDT
2015-06/P(1)0000182.pdf,664,26,374,99.95,1.85,2015-06-23,2015-06-24,"""People can tolerate two homosexuals they see leaving together, but the next day they're smiling, holding hands, tenderly embracing one another, then they cannot be forgiven. It is not the departure for pleasure that is unacceptable, it is waking up happy."" -Michel Foucault, philosopher and social critic. #lgbt #homophobia #Foucault #society #queerquote",https://www .facebook.com/LGBT-United-839497 472793277 /,United States,18 - 65+,NA,NA,NA,News Feed on desktop computers or News Feed on mobile  News Feed on desktop computers or News Feed on mobile devices," People who like LGBT United, Friends of connections: Friends of people who are connected to LGBT United",NA,NA,26,37 4,99.95 RUB,06/23/15 07:02:40 AM PDT,06/24/15 07:02:39 AM PDT
2015-06/P(1)0002130.pdf,344,59,708,173.92,3.21,2015-06-23,2015-06-24,What else has to happen for you all to realize black lives matter?,https://www.facebook.com/Black-Matters-1579673598947501/,"United States: Baltimore Maryland: Ferguson, St. Louis Missouri: Cleveland Ohio",18 - 65+,NA,NA,NA,News Feed on desktop computers or News Feed on mobile  News Feed on desktop computers or News Feed on mobile devices, People who like Black Matters. Friends of connections: Friends of people who are connected to Black Matters,NA,NA,59,708,173.92 RUB,06/23/15 07:41:01 AM PDT,06/24/15 07:41 01 AM PDT
2015-06/P(1)0002131.pdf,345,48,759,258.89,4.78,2015-06-23,2015-06-24,"Thousands Walk Hand In Hand Across Ravenel Bridge To Show Support For Mother Emanuel Church On Sunday evening, hours after Emanuel A.M.E. Church opened its doors for the first service following the killing of nine of its congregants Wednesday, thousands in Charleston took to the streets in a show of support and solidarity. Observers on the bridge, and thousands more at the base, joined hands to create a ""unity chain,"" then held a moment of silence that lasted five minutes in honor of the fallen. Police estimated that 10,000 to 15,000 took part in Sunday's gathering, according to the Post and Courier. Cars drove slowly past the bridge, taking in the sight and honking horns in solidarity as people chanted ""Charleston strong!"" Throughout history people start to unite only when they face danger or when they're in times of great sorrow. Modern America is accustomed to meet only imaginary dangers, however, Americans are getting more and more reasons to sorrow over something day by day. Does it mean that the key to the unity of 330 million Americans is constant fear and unending sorrow? Does it mean that only this can make Americans unite and forget about the infighting and differences? Unfortunately, yes, it does.",https://www.facebook.com/Black-Matters-1579673598947501/,"United States: Baltimore Maryland; Ferguson, St. Louis Missouri; Cleveland Ohio",18 - 65+,NA,NA,NA,News Feed on desktop computers or News Feed on mobile  News Feed on desktop computers or News Feed on mobile devices," People who like Black Matters, Friends of connections: Friends of people who are connected to Black Matters",NA,NA,48,759,258.89 RUB,06/23/15 07:41:21 AM PDT,06/24/15 07:41:20 AM PDT
2015-06/P(1)0002132.pdf,346,65,757,174.35,3.22,2015-06-23,2015-06-24,"Whatever the white man has done. Black Americans have done, and often even better. Miss Black America in 1969.",https://www.facebook.com/Black-Matters-1579673598947501/,"United States: Baltimore Maryland: Ferguson, St. Louis Missouri: Cleveland Ohio",18 - 65+,NA,NA,NA,News Feed on desktop computers or News Feed on mobile devices, People who like Black Matters. Friends of connections: Friends of people who are connected to Black Matters,NA,NA,65,757,174.35 RUB,06/23/15 07:41:58 AM PDT,06/24/15 07:41:58 AM PDT
2015-06/P(1)0002133.pdf,347,57,581,174.26,3.22,2015-06-23,2015-06-24,"How many of you believe in Black Jesus? There is quite a big number of people arguing about ethnicity of Jesus Christ. Was Jesus white, olive-skinned or black? The Coptic Museum in Cairo, Egypt owns the earliest painting of Jesus Christ in the Church of Rome (6th century) where skin color of Jesus was black.",https://www.facebook.com/Black-Matters-1579673598947501/,"United States: Baltimore Maryland; Ferguson, St. Louis Missouri; Cleveland Ohio",18 - 65+,NA,NA,NA,News Feed on desktop computers or News Feed on mobile  News Feed on desktop computers or News Feed on mobile devices," People who like Black Matters, Friends of connections: Friends of people who are connected to Black Matters",NA,NA,57,581,174.26 RUB,06/23/15 07:42:12 AM PDT,06/24/15 07:42:11 AM PDT
2015-06/P(1)0002134.pdf,348,74,796,174.02,3.21,2015-06-23,2015-06-24,Black is beautiful. God knows what he is doing. The Black skin is a glorious symbol of national greatness.,https://www.facebook.com/Black-Matters-1579673598947501/,"United States: Baltimore Maryland: Ferguson, St. Louis Missouri: Cleveland Ohio",18 - 65+,NA,NA,NA,News Feed on desktop computers or News Feed on mobile  News Feed on desktop computers or News Feed on mobile devices, People who like Black Matters. Friends of connections: Friends of people who are connected to Black Matters,NA,NA,74,796,174.02 RUB,06/23/15 07:42:35 AM PDT,06/24/15 07:42:34 AM PDT
2015-06/P(1)0002135.pdf,349,23,412,174.75,3.23,2015-06-23,2015-06-24,"A small group of activists burned two confederate flags in response to shooting in Charleston, South Carolina. Why the symbol of the pro-slavery rebellion is still flying on the ground of South Carolina? Why the symbol of white supremacy is still flying on the South Carolina statehouse in Columbia? Why the flag that represents the murder of blacks was not removed from the national statehouse? The confederate flag represents terrorism, reminding us about the slavery time, racism and people that were murdered in a hate-crime. Today, we ask to remove this symbol of racism that flies 120 miles away from the Emanuel African Methodist Episcopal Church in Charleston. Yes, we must wipe off every single symbol of racism from the United States of America including the confederate flag, KKK and other racist organizations. We must give new names to the streets which were named after racist political figures and slave traders. We must remove monuments dedicated to Andrew Jackson, Robert Lee, Benjamin Huger, James Longstreet who owned slaves on their farms. How can we ever expect to get the racist symbols removed until we show ourselves to be men the same as any other race of men?",https://www.facebook.com/Black-Matters-1 579673598947501/,"United States: Baltimore Maryland; Ferguson, St. Louis Missouri; Cleveland Ohio",18 - 65+,NA,NA,NA,News Feed on desktop computers or News Feed on mobile  News Feed on desktop computers or News Feed on mobile devices," People who like Black Matters, Friends of connections: Friends of people who are connected to Black Matters",NA,NA,23,412,174.75 RUB,06/23/15 07:42:57 AM PDT,06/24/15 07:42:56 AM PDT
2015-06/P(1)0002255.pdf,422,73,733,173.41,3.2,2015-06-23,2015-06-24,"Philosophy of African-American activist Huey Newton Huey Newton was an African-American political activist and a leader of generation of black, best known for founding the militant Black Panther Party in 1966. As a child, Newton experienced racial discrimination that influenced him to create the Black Panther Party as a voice of black people. His party grew up to a size of 5,000 full time party workers in 45 branches across America and inspired generation in North America to join the struggle against oppression. But he was shot to death in August 1989.",https://www.facebook.com/Black-Matters-1579673598947501/,"United States: Baltimore Maryland; Ferguson, St. Louis Missouri; Cleveland Ohio",18 - 65+,NA,NA,NA,News Feed on desktop computers or News Feed on mobile  News Feed on desktop computers or News Feed on mobile devices," People who like Black Matters, Friends of connections: Friends of people who are connected to Black Matters",NA,NA,73,733,173.41 RUB,06/23/15 07:43:14 AM PDT,06/24/15 07:43:14 AM PDT
2015-06/P(1)0002256.pdf,423,83,1012,261.08,4.82,2015-06-23,2015-06-24,"More riots are coming this summer ... unless What is the most important thing the government must to do this year in order our country to live in peace? The criminal justice system is very important institution where law enforcement investigate a crime gathering evidences to identify the presumed perpetrator ensuring that rights of the convicted are respected. But what if American criminal justice reform outdated and the country need to focus on a renewed sense of justice? What if disproportionate punishment is the main challenge of the criminal justice system? Disproportionate punishments known far and wide across the United States of America. Consequently, the victim's skin color plays a crucial role in deciding what kind of punishment he will receive. For instance, you are more likely to be sentenced to death if you have killed a white person. Frankly speaking, if the government wants to keep the country away from the summer urban riots, then they must think about the living standards of black population that is several times below the living standards of white people in America. In addition, the White House must reduce the unemployment rates of black population by revising the hiring policy for black Americans.Therefore, if we want a life's balance, the government have to reconsider all these things, because Black Americans lives matter.",https://www.facebook.com/Black-Matters-1579673598947501/,"United States: Baltimore Maryland; Ferguson, St. Louis Missouri; Cleveland Ohio",18 - 65+,NA,NA,NA,News Feed on desktop computers or News Feed on mobile  News Feed on desktop computers or News Feed on mobile devices," People who like Black Matters, Friends of connections: Friends of people who are connected to Black Matters",NA,NA,83,"1,012",261.08 RUB,06/23/15 07:43:35 AM PDT,06/24/15 07:43:35 AM PDT
2015-06/P(1)0002258.pdf,425,72,755,173.57,3.21,2015-06-23,2015-06-24,7-Year-Old Madeleine from Charleston drew this picture in order to show us that being colorblind is awesome and we should give it a try.,https://www.facebook.com/Black-Matters-1579673598947501/,"United States: Baltimore Maryland: Ferguson, St. Louis Missouri: Cleveland Ohio",18 - 65+,NA,NA,NA,News Feed on desktop computers or News Feed on mobile  News Feed on desktop computers or News Feed on mobile devices, People who like Black Matters. Friends of connections: Friends of people who are connected to Black Matters,NA,NA,72,755,173.57 RUB,06/23/15 07:43:51 AM PDT,06/24/15 07:43:50 AM PDT
2015-06/P(1)0002273.pdf,438,39,815,798.92,14.76,2015-06-23,NA,Patriotism comes from your heart... follow its dictates and don't live life. Join!,https://www.facebook.com/patriototus,United States,18 - 65+,NA,Exclude people who like Being Patriotic,English (UK)or English (US),News Feed on desktop computers or News Feed on mobile  News Feed on desktop computers or News Feed on mobile devices,NA,Independence or Patriotism,NA,39,815,798.92 RUB,06/23/15 07:09:49 AM PDT,NA
2015-06/P(1)0002287.pdf,447,0,0,0,0,2015-06-23,NA,"We can't all be Presidents, but we can all be patriots. Join us!",https://www.facebook.com/patriototus,United States,18 - 65+,NA,Exclude people who like Being Patriotic,English (UK)or English (US),News Feed on desktop computers or News Feed on mobile  News Feed on desktop computers or News Feed on mobile devices,NA,Independence or Patriotism,NA,0,0,None,06/23/15 07:08:59 AM PDT,NA
2015-06/P(1)0002293.pdf,450,72043,529205,331675.75,6126.6,2015-06-23,NA,United We Stand! Welcome every patriot we can reach. Flag and news!,https://www.facebook.com/patriototus/,United States,18 - 65+,NA,Exclude people who like Being Patriotic,English (UK)or English (US),News Feed on desktop computers or News Feed on mobile  News Feed on desktop computers or News Feed on mobile devices,NA,Independence or Patriotism,NA,"72,043","529,205","331,675.75 RUB",06/23/15 12:41:02 AM PDT,NA
2015-06/P(1)0002299.pdf,453,0,0,0,0,2015-06-23,NA,"We can't all be Presidents, but we can all be patriots. Join us!",https://www.facebook.com/patriototus,United States,18 - 65+,NA,Exclude people who like Being Patriotic,English (UK)or English (US),News Feed on desktop computers or News Feed on mobile  News Feed on desktop computers or News Feed on mobile devices,NA,Independence or Patriotism,NA,0,0,None,06/23/15 07:08:58 AM PDT,NA
2015-06/P(1)0002327.pdf,481,0,0,0,0,2015-06-23,NA,Patriotism begins at home. Join new community about homeland!,https://www.facebook.com/patriototus,United States,18 - 65+,NA,Exclude people who like Being Patriotic,English (UK)or English (US),News Feed on desktop computers or News Feed on mobile  News Feed on desktop computers or News Feed on mobile devices,NA,Independence or Patriotism,NA,0,0,None,06/23/15 07:10:47 AM PDT,NA
2015-06/P(1)0002331.pdf,484,0,0,0,0,2015-06-23,NA,Patriotism comes from your heart... follow its dictates and don't live life. Join!,https://www.facebook.com/patriototus,United States,18 - 65+,NA,Exclude people who like Being Patriotic,English (UK)or English (US),News Feed on desktop computers or News Feed on mobile  News Feed on desktop computers or News Feed on mobile devices,NA,Independence or Patriotism,NA,0,0,None,06/23/15 07:09:49 AM PDT,NA
2015-06/P(1)0002357.pdf,504,0,0,0,0,2015-06-23,NA,Patriotism begins at home. Join new community about homeland!,https://www.facebook.com/patriototus,United States,18 - 65+,NA,Exclude people who like Being Patriotic,English (UK)or English (US),News Feed on desktop computers or News Feed on mobile  News Feed on desktop computers or News Feed on mobile devices,NA,Independence or Patriotism,NA,0,0,None,06/23/15 07:10:47 AM PDT,NA
2015-06/P(1)0002359.pdf,505,59,742,434.53,8.03,2015-06-23,NA,Your freedom starts here. Join!,https://www.facebook.com/patriototus,United States,18 - 65+,NA,Exclude people who like,English (UK)or English (US),News Feed on desktop computers or  News Feed on desktop computers or devices,NA,Independence or Patriotism,NA,59,742,434.53 RUB,06/23/15 07:10:04 AM PDT,NA
2015-06/P(1)0002382.pdf,520,0,0,0,0,2015-06-23,NA,Your freedom starts here. Join!,https://www.facebook.com/patriototus,United States,18 - 65+,NA,Exclude people who like,English (UK)or English (US),News Feed on desktop computers or  News Feed on desktop computers or devices,NA,Independence or Patriotism,NA,0,0,None,06/23/15 07:10:04 AM PDT,NA
2015-06/P(1)0002424.pdf,551,0,0,0,0,2015-06-23,2015-06-24,"Republican strategist Karl Rove said on ""Fox News Sunday"" the only way to stop gun-related violence, like the Wednesday massacre at Emmanuel African Methodist Church in Charleston S.C., was to repeal American citizens' Second Amendment rights. It's strange to hear it from the man who supported 2nd amendment earlier. The lack of clear-cut opinion is very bad character trait. However, it doesn't matter. The right to bear arms is inalienable right of Americans that was given us by the Founding Fathers. The 2nd amendment guarantees private safety of the people. The right to keep and bear arms has been recognized as existing prior even to the creation of a written national constitution. The govermmnet should respect the 2nd amendment and the law in general. It's pity when some politicians think otherwise. People should understand that a gun is not a killing tool, it's self-defense tool. And we will stand for our right to keep and bear arms!",https://www.facebook.com/patriototus,United States,18 - 65+,NA,NA,NA,News Feed on desktop computers or News Feed on mobile  News Feed on desktop computers or News Feed on mobile devices,NA,Independence or Patriotism,NA,0,0,None,06/23/15 07:13:22 AM PDT,06/24/15 07:13:22 AM PDT
2015-06/P(1)0002426.pdf,552,0,0,0,0,2015-06-23,2015-06-24,"The Chinese hackers executed a complex attack that gave them ""administrator privileges"" into the computer networks at the Office of Personnel Management, mimicking the credentials of people who run the agency's systems. They began siphoning out a rush of data after constructing what amounted to an electronic pipeline that led back to China, investigators told Congress last week in classified briefings. Much of the personnel data had been stored in the lightly protected systems of the Department of the Interior, because it had cheap, available space for digital data storage. The administration is urgently working to determine what other agencies are storing similarly sensitive information with weak protections. Officials would not identify their top concerns, but an audit issued early last year, before the Chinese attacks, harshly criticized lax security at the Internal Revenue Service, the Nuclear Regulatory Commission, the Energy Department, the Securities and Exchange Commission  and the Department of Homeland Security, which has responsibility for securing the nation's critical networks. It's not clear who is held liable for security hole. What do you think the hacker attack will affect U.S.  Chinese relations?",https://www.facebook.com/patriototus,United States,18 - 65+,NA,NA,NA,News Feed on desktop computers or News Feed on mobile  News Feed on desktop computers or News Feed on mobile devices,NA,Independence or Patriotism,NA,0,0,None,06/23/15 07:14:41 AM PDT,06/24/15 07:14:41 AM PDT
2015-06/P(1)0002428.pdf,553,0,0,0,0,2015-06-23,2015-06-24,"The Battle of Okinawa, codenamed Operation Iceberg, came to the end on June 22, 1945. The operation was fought on the Ryukyu Islands of Okinawa and included the largest amphibious assault in the Pacific War during World War II. The military value of Okinawa ""exceeded all hope."" Okinawa provided a fleet anchorage, troop staging areas, and airfields in close proximity to Japan.",https://www.facebook.com/patriototus,United States,18 - 65+,NA,NA,NA,News Feed on desktop computers or News Feed on mobile  News Feed on desktop computers or News Feed on mobile devices,NA,Independence or Patriotism,NA,0,0,None,06/23/15 07:37:18 AM PDT,06/24/15 07:37:18 AM PDT
2015-06/P(1)0002430.pdf,554,0,0,0,0,2015-06-23,2015-06-24,"Since the game of American football was first played at the collegiate level in the late 1860s, the sport has captivated fans by using both strength and strategy to get the win. With the introduction of the American Professional Football Association, later renamed to the National Football League, audiences saw athletes play more ferociously than ever before. American football has actually became national kind of sports in the United States. We are proud of such players as Michael Vick, Peyton Manning and John Elway. We are proud we live in America!",https://www.facebook.com/patriototus,United States,18 - 65+,NA,NA,NA,News Feed on desktop computers or News Feed on mobile  News Feed on desktop computers or News Feed on mobile devices,NA,Independence or Patriotism,NA,0,0,None,06/23/15 07:13:53 AM PDT,06/24/15 07:13:52 AM PDT
2015-06/P(1)0002432.pdf,555,0,0,0,0,2015-06-23,2015-06-24,"It is a symbol of patriots who were willing to die in order to protect this country and to make sure it has remained as the founders intended. South Carolina governor calls for removal of Confederate flag from statehouseGovernor Nikki Haley makes abrupt about-face in wake of Charleston killings to call for removal of flag that has flown on statehouse grounds for 50 years The Confederate flag represents heritage, not hate. The war that is called the ""Civil War"" was actually the ""War for Southern Independence"". This is our history and our heritage. Just because certain groups have used the confederate flag in hate related crimes or racism does not make the southern flag racist. Now it is used to show heritage and pride from the south showing that they have been strong and have overcome what has happened to them over time.",https://www.facebook.com/patriototus,United States,18 - 65+,NA,NA,NA,News Feed on desktop computers or News Feed on mobile  News Feed on desktop computers or News Feed on mobile devices,NA,Independence or Patriotism,NA,0,0,None,06/23/15 08:23:32 AM PDT,06/24/15 08:23:32 AM PDT
2015-06/P(1)0002434.pdf,556,0,0,0,0,2015-06-23,2015-06-24,"Why do immigrants think that the U.S. government should create good conditions for them? I think immigrants should prove that they are deserved to stay in the United States. Why should we give a citizenship to those who cannot give something good for the nation? The worst thing is that illegal immigrants who broke the law to live in the United States demand ask for indulgences. What nonsense! Illegals should be deported from the country invariably. But Obama's administration is tied to the chariot of immigrants. Democrats know that immigrants will vote for the Democratic party. Especially former illegals. That's why Barack Obama tries to give the Immigration Amnesty to illegals as soon as possible. It will allow to increase a number of votes for a Democratic Party presidential candidate in 2016. And democrats don't care about the fact that most of immigrants will become welfare recipients, increasing unemployment rate. America doesn't need immigrants, democrats do. What's more important: to win Presidential elections in 2016 or to make America better? Democrats seem to choose first option. That's what differs republicans from democrats.",https://www.facebook.com/patriototus,United States,18 - 65+,NA,NA,NA,News Feed on desktop computers or News Feed on mobile  News Feed on desktop computers or News Feed on mobile devices,NA,Independence or Patriotism,NA,0,0,None,06/23/15 07:37:02 AM PDT,06/24/15 07:37:02 AM PDT
2015-06/P(1)0002436.pdf,557,0,0,0,0,2015-06-23,2015-06-24,Our flag is one with colors every so bright A symbol of goodwill and all that's right It is a beacon for those who are oppressed Who pine to live in the land of the blessed The photo of the Apollo 15 space shuttle on the Moon is historic moment in the history of the world. This was the first time that a man stepped foot on the Moon.,https://www.facebook.com/patriototus,United States,18 - 65+,NA,NA,NA,News Feed on desktop computers or News Feed on mobile  News Feed on desktop computers or News Feed on mobile devices,NA,Independence or Patriotism,NA,0,0,None,06/23/15 07:13:03 AM PDT,06/24/15 07:13:03 AM PDT
2015-06/P(1)0002476.pdf,584,3206,31618,16630.2,307.19,2015-06-23,NA,We speak for all fellow members of LGBT community across the nation.,https://www.facebook.com/Igbtun/,United States,18 - 65+,NA,Exclude people who like LGBT United,English (UK)or English (US),News Feed on desktop computers or News Feed on mobile  News Feed on desktop computers or News Feed on mobile devices,NA,"Motherhood, Philosophy, LGBT community, Indiana, Homosexuality, Love or Society",NA,"3,206","31,618","16,630.20 RUB",06/23/15 05:06:57 AM PDT,NA
2015-06/P(1)0002569.pdf,653,25,633,179.89,3.32,2015-06-23,2015-06-24,"THE COLORFUL ACTIVISM OF NEW YORK'S MOST RADICAL QUEERS These wonderful people creating a powerful community through progressive politics, community gardens, wild parties, and colorful performance. Call them the radical queers, and know that the term is flexible; and evolving. From the local gardens of the East Village to Bushwick warehouses; a new wave of New York artists; thinkers and activists young and old. They are banding together to question and redefine what it means to be queer today. It's beauty; perfection; freedom, and of course lots and lots of LOVE! #Igbtq #queer #NYC #art #glamour #perfection",https://www.facebook.com/LGBT-United-839497472793277/,United States,18 - 65+,NA,NA,NA,News Feed on desktop computers or News Feed on mobile  News Feed on desktop computers or News Feed on mobile devices," People who like LGBT United, Friends of connections: Friends of people who are connected to LGBT United",NA,NA,25,633,179.89 RUB,06/23/15 07:03:29 AM PDT,06/24/15 07:03:28 AM PDT
2015-06/P(1)0002571.pdf,654,49,691,183.93,3.4,2015-06-23,NA,"NOM'S LAST ATTEMPT TO BAN SAME SEX MARRIAGE National Organization for Marriage is asking all of the GOP presidential candidates to sign an anti-equality pledge. Let's take a look at just how crazy this pledge gets. That's just nuts! They want candidates to support a constitutional amendment to ban marriage nationwide. This will never happen. For the last decade public support for marriage equality has gone from 35 percent to 55 percent! But they don't stop there. NOM also wants candidates to ""work to overturn any Supreme Court decision"" in favor of the freedom to marry. NOM wants the president to only nominate judges who will uphold marriage bans, but at this point, legal consensus so strongly supports marriage equality that supporting marriage bans is a sign that person isn't qualified to be a judge. Also, NOM wants the candidates to weaken civil rights laws, creating loopholes to let companies and citizens to discriminate if they cite a religious justification. That could actually happen  and it already has in some states  so it's a huge concern. And fifth, they want the Department of Justice to investigate harassment against people who oppose marriage equality. Sure, gays and lesbians are harassed every day, fired, kicked out of their homes and schools, separated from their families, but I really hope soon there'll be NO MORE of it! There's a part of me that feels very sad for NOM's fanatics. When they finally kick the bucket, they'll be dealing with the reality (whether they openly face it or not) that their Life's Work has amounted to NOTHING. Nothing they worked for made anyone's life better. At all. They didn't win, and they wasted their lives fighting against the inevitable. And when they're dead and gone, they'll be remembered only as footnotes in shameful history  or more likely they'll be forgotten completely. #LGBT #NOM #SameSexMarriage #Marriage #SCOTUS #equality",https://www.facebook.com/LGBT-United-839497472793277/,United States,18 - 65+,NA,NA,NA,News Feed on desktop computers or News Feed on mobile  News Feed on desktop computers or News Feed on mobile devices," People who like LGBT United, Friends of connections: Friends of people who are connected to LGBT United",NA,NA,49,691,183.93 RUB,06/23/15 07:03:47 AM PDT,NA
2015-06/P(1)0002574.pdf,656,150,1484,368.34,6.8,2015-06-23,2015-06-24,"RUBY ROSE SHARING THOUGHTS ABOUT GENDER FLUIDITY. Ruby Rose has long been the celebrity crush of lesbians the world over. But now that she's a star in 'Orange is the New Black', the popularity of this model, actress, and VJ has grown worldwide. ""Gender fluidity is not really feeling like you're at one end of the spectrum or the other. For the most part, I definitely don't identify as any gender,"" - Rose said; - ""I'm not a guy; I don't really feel like a woman, but obviously I was born one. As a little kid, I was convinced that I was a guy. Then in my teens, I tried to be quite feminine...And after a little bit, chopped everything off and am kind of back where I started. So, I'm somewhere in the middle, which - in my perfect imagination - is like having the best of both sexes."" #Igbt #RubyRose #GenderFluidity #lesbian #OrangelsTheNewBlack",https://www.facebook.com/LGBT-United-839497472793277/,United States,18 - 65+,NA,NA,NA,News Feed on desktop computers or News Feed on mobile  News Feed on desktop computers or News Feed on mobile devices," People who like LGBT United, Friends of connections: Friends of people who are connected to LGBT United",NA,NA,150,"1,484",368.34 RUB,06/23/15 07:04:59 AM PDT,06/24/15 07:04:59 AM PDT
2015-06/P(1)0002576.pdf,657,1,30,9.15,0.17,2015-06-23,2015-06-24,"Pete Buttigieg is South Bend's 32nd mayor and America's youngest mayor of a city of over 100,000 residents. Recently Buttigieg came out publicly as gay. In life and in service, people like Pete is an inspiration for us all! #Igbt #QueerQuote #USpolitics #Indiana #ComingOut #Buttigieg",https://www.facebook.com/LGBT-United-839497472793277/,United States,18 - 65+,NA,NA,NA,News Feed on desktop computers or News Feed on mobile  News Feed on desktop computers or News Feed on mobile devices," People who like LGBT United, Friends of connections: Friends of people who are connected to LGBT United",NA,NA,1,30,9.15 RUB,06/23/15 07:04:39 AM PDT,06/24/15 07:04:39 AM PDT
2015-06/P(1)0002578.pdf,658,80,791,181.49,3.35,2015-06-23,2015-06-24,"The ninth transgender was found death in the USA Transgender teen Mercedes Williamson was found dead in a wooded area. She is the ninth confirmed transgender homicide victim in the USA this year. Police in George County. Mississippi have charged a suspect Josh Brandon Vallum. Police said that Mercedes and Josh knew each other, but it is not clear if Vallum knew Williamson was a transgender. Jeanie Miller, whom Williamson had been living with, said that Vallum knew that Williamson was transgender. Modern America is too dangerous for transgenders. This is the ninth transgender killing based on gender identity. According to the National Coalition of Anti-Violence Programs' report hate-motivated violence against transgenders rose 13%. Unfortunately, it is very difficult to live as a transgender in the South. Alabama even passed a religious freedom law in 1998 that allows discrimination against LGBT people. That also allows lawmakers to justify hostility toward transgender people. And that we call `freedom'? America is no longer land of freedom!",https://www.facebook.com/LGBT-United-839497472793277/,United States,18 - 65+,NA,NA,NA,News Feed on desktop computers or News Feed on mobile  News Feed on desktop computers or News Feed on mobile devices, People who like LGBT United. Friends of connections: Friends of people who are connected to LGBT United,NA,NA,80,791,181.49 RUB,06/23/15 07:33:17 AM PDT,06/24/15 07:33:17 AM PDT
2015-06/P(1)0002590.pdf,665,37,365,91.81,1.7,2015-06-23,2015-06-24,"""Gay, Lesbian, Bi, and Straight, we are the community and family of God, and we are here knowing God loves us."" -Rev. Nathan Baxter #Igbtq #together #community #Gay #Lesbian #Transgender #NatanBaxter",https://www.facebook.com/LGBT-United-839497472793277/,United States,18 - 65+,NA,NA,NA,News Feed on desktop computers or News Feed on mobile  News Feed on desktop computers or News Feed on mobile devices," People who like LGBT United, Friends of connections: Friends of people who are connected to LGBT United",NA,NA,37,365,91.81 RUB,06/23/15 07:03:13 AM PDT,06/24/15 07:03:12 AM PDT
2015-06/P(1)0002242.pdf,408,60,636,189.05,3.46,2015-06-24,2015-06-25,"African-American soldiers played a decisive role in the US Army on the western frontier during the Plains Wars, but it's not mentioned in our history books.",https://www.facebook.com/Black-Matters-1579673598947501/,"United States: Baltimore Maryland; Ferguson, St. Louis Missouri; Cleveland Ohio",18 - 65+,NA,NA,NA,News Feed on desktop computers or News Feed on mobile  News Feed on desktop computers or News Feed on mobile devices," People who like Black Matters, Friends of connections: Friends of people who are connected to Black Matters",NA,NA,60,636,189.05 RUB,06/24/15 06:12:24 AM PDT,06/25/15 06:12:23 AM PDT
2015-06/P(1)0002243.pdf,409,0,0,0,0,2015-06-24,2015-06-25,"Cornel West on Obama:""The First Black President Has Become The First Niggerized Black President"" Reacting to President Obama's use of the n-word on Marc Maron's podcast, Cornel West called him the first ""niggerized"" president in an appearance on CNN. West criticized Obama as ""a person who is afraid and intimidated when it comes to putting a spotlight on white supremacy."" ""A niggerized black person is a black person who is afraid and scared and intimidated when it comes to putting a spotlight on white supremacy and fighting against white supremacy,"" West explained. ""So when many of us said we have to fight against racism, what were we told?'No, he can't deal with racism because he has other issues, political calculations. He's the president of all America, not just black America.' We know he's president of all America but white supremacy is American as cherry pie."" West is right as usual. African minorities would choose Mr. West in 2009 and 2012 instead of Obama. But we had no choice. Cornel is a good leader, he knows what black community is suffering from. Obama was promoted by big corporations owned by white people. Obama never tried to protect blacks from police pressure, never tried to stop police violence against blacks. Just count how many black lives were destroyed during his presidency. The number is horrific.",https://www.facebook.com/Black-Matters-1 579673598947501/,"United States: Baltimore Maryland; Ferguson, St. Louis Missouri; Cleveland Ohio",18 - 65+,NA,NA,NA,News Feed on desktop computers or News Feed on mobile  News Feed on desktop computers or News Feed on mobile devices," People who like Black Matters, Friends of connections: Friends of people who are connected to Black Matters",NA,NA,0,0,None,06/24/15 06:03:43 AM PDT,06/25/15 06:03:42 AM PDT
2015-06/P(1)0002244.pdf,410,12,71,22.75,0.42,2015-06-24,2015-06-25,"Autopsy Says Freddie Gray Died After Sustaining 'High-Energy Injury' in Police Van The Baltimore state medical examiner's office has found that Freddie Gray likely died from a single ""high-energy injury"" sustained as he rode shackled in the back of a police van on the day of his arrest, according to an autopsy report obtained by the Baltimore Sun. The autopsy report suggested that Gray may have attempted to stand up during the van ride, and that the injury could have occurred as he was thrown against the van wall when the vehicle changed direction. Like really? When police took Gray to the hospital, doctors determined that he had sustained a severed spine and crushed voice box. High-energy injury? We don't think so. It's hard to believe. Do they think we're idiots or something? Cops imprison you, shoot you, sever your spine, crush your larynx, send you to war, keep you poor, call you a thug and get away with it. There's no excuse for what happened to Freddie.",https://www.facebook.com/Black-Matters-1 579673598947501/,"United States: Baltimore Maryland; Ferguson, St. Louis Missouri; Cleveland Ohio",18 - 65+,NA,NA,NA,News Feed on desktop computers or News Feed on mobile  News Feed on desktop computers or News Feed on mobile devices," People who like Black Matters, Friends of connections: Friends of people who are connected to Black Matters",NA,NA,12,71,22.75 RUB,06/24/15 06:53:54 AM PDT,06/25/15 06:53:54 AM PDT
2015-06/P(1)0002257.pdf,424,0,0,0,0,2015-06-24,2015-06-25,"Fifty years ago, 48% of African American adults and 57% of African American children lived in poverty. Today, only 28% of African American adults and 38% of African American children live in poverty. We've come so far, but still there is a long way to go.",https://\vww.facebook.com/Black-Matters-1579673598947501/,"United States: Baltimore Maryland: Ferguson, St. Louis Missouri; Cleveland Ohio",18 - 65+,NA,NA,NA,News Feed on desktop computers or News Feed on mobile  News Feed on desktop computers or News Feed on mobile devices, People who like Black Matters. Friends of connections: Friends of people who are connected to Black Matters,NA,NA,0,0,None,06/24/15 12:15:01 AM PDT,06/25/15 12:15:00 AM PDT
2015-06/P(1)0002580.pdf,659,0,0,0,0,2015-06-24,2015-06-25,"Matt Cage comes out as gay The pro wrestler Matt Cage, known as 'Money' publicly announced that he is gay in a Facebook post. Previously Matt Hullum identified himself as bisexual. Sorry, ladies. I'm officially pulling myself off of the market. Don't hate me too bad.' 'I truly have nothing to hide anymore,' he wrote. 'I spent the majority of my life lying, hiding and depressed because I felt like I couldn't truly be who I wanted to be and live freely as I saw fit. I had to act and that's not me. I, nor anyone else, should have to do that.' Matt decided to tell the truth publicly because of speculation that was going behind his back. This news should please all progressive humanity because the coming-out once again confirms the fact that homosexuality and masculinity are a perfect combination and do not contradict each other.",https://www.facebook.com/LGBT-United-839497472793277/,United States,18 - 65+,NA,NA,NA,News Feed on desktop computers or News Feed on mobile  News Feed on desktop computers or News Feed on mobile devices," People who like LGBT United, Friends of connections: Friends of people who are connected to LGBT United",NA,NA,0,0,None,06/24/15 07:15:12 AM PDT,06/25/15 07:15:12 AM PDT
2015-06/P(1)0002582.pdf,660,3,118,42.94,0.79,2015-06-24,2015-06-25,"First LGBT studies course opens in a San Francisco high school A San Francisco high school may be the first US school to offer an LGBT studies course. The course will teach terminology and the history of LGBT movement. ""We'll look at what it's been like for gay men, what it's been like for lesbian women, what it's been like for transgender people,"" Ruth Asawa High School Social Studies teacher Lyndsey Schlax told. Schlax has been working with Cleve Jones, a human rights activist, who was mentored by Harvey Milk. It is proposed that the class will begin in autumn. Really perfect idea! There are at least twenty eight percent of LGBT students in Asawa High School. It is the fact that we need such classes in every American school! Children shouldn't be afraid to show who they are; they shouldn't be afraid to speak about LGBT history; they should know that it is normal to be gay or lesbian or transgender. Everybody should be taught to understand LGBT people and recognize them as ordinary citizens.",https://www.facebook.com/LGBT-United-839497472793277/,United States,18 - 65+,NA,NA,NA,News Feed on desktop computers or News Feed on mobile  News Feed on desktop computers or News Feed on mobile devices," People who like LGBT United, Friends of connections: Friends of people who are connected to LGBT United",NA,NA,3,118,42.94 RUB,06/24/15 07:15:44 AM PDT,06/25/15 07:15:43 AM PDT
2015-06/P(1)0002584.pdf,661,12,102,53.13,0.97,2015-06-24,2015-06-25,"Good morning, dear friends! Have a tasty and colorful morning! All you need is love, coffee and rainbow dishes!",https://www.facebook.com/LGBT-United-839497472793277/,United States,18 - 65+,NA,NA,NA,News Feed on desktop computers or News Feed on mobile  News Feed on desktop computers or News Feed on mobile devices," People who like LGBT United, Friends of connections: Friends of people who are connected to LGBT United",NA,NA,12,102,53.13 RUB,06/24/15 07:16:43 AM PDT,06/25/15 07:16:43 AM PDT
2015-06/P(1)0002245.pdf,411,42,332,81.49,1.49,2015-06-25,2015-06-26,"Ella Baker. The woman behind the scenes. Not many of you will probably be able to recognize Ella Baker, who was a hero of the civil rights Freedom Movement, racial and economic injustice for five decades. Her job was to put together the pieces in order to create a strong organization in the face of racism and injustice. She played a key role in NAACP; Student Nonviolent Coordinating Committee and Martin Luther King's Southern Christian Leadership Conference.",https://www.facebook.com/Black-Matters-1579673598947501/,"United States: Baltimore Maryland: Ferguson, St. Louis Missouri; Cleveland Ohio",18 - 65+,NA,NA,NA,News Feed on desktop computers or News Feed on mobile  News Feed on desktop computers or News Feed on mobile devices, People who like Black Matters. Friends of connections: Friends of people who are connected to Black Matters,NA,NA,42,332,81.49 RUB,06/25/15 08:10:53 AM PDT,06/26/15 08:10:53 AM PDT
2015-06/P(1)0002246.pdf,412,12,215,79.57,1.46,2015-06-25,2015-06-26,Black Matters,https://www.facebook.com/Black-Matters-1579673598947501/,"United States: Baltimore Maryland: Ferguson, St. Louis Missouri: Cleveland Ohio",18 - 65+,NA,NA,NA,News Feed on desktop computers or News Feed on mobile  News Feed on desktop computers or News Feed on mobile devices, People who like Black Matters. Friends of connections: Friends of people who are connected to Black Matters,NA,NA,12,215,79.57 RUB,06/25/15 08:10:19 AM PDT,06/26/15 08- 10- 18 AM PDT
2015-06/P(1)0002586.pdf,662,61,920,400,7.32,2015-06-25,2015-06-26,Silent no more: we deserve equal rights! This photo of gay rights protest was made in New York in 1971. These are early days in the fight for gay rights.,https://www.facebook.com/LGBT-United-839497472793277/,United States,18 - 65+,NA,NA,NA,News Feed on desktop computers or News Feed on mobile  News Feed on desktop computers or News Feed on mobile devices," People who like LGBT United, Friends of connections: Friends of people who are connected to LGBT United",NA,NA,61,920,400.00 RUB,06/25/15 04:16:59 AM PDT,06/26/15 04:16:59 AM PDT
2015-06/P(1)0002588.pdf,663,74,1038,400,7.32,2015-06-25,2015-06-26,"California Attorney General ruled against the execution of gays and lesbians A California judge argued against a proposed initiative about the execution of gay and lesbian people, naming this measure ""unconstitutional on its face."" The Sodomite Suppression Act proposes that ""any person who willingly touches another person of the same gender for purposes of sexual gratification be put to death by bullets to the head or by any other convenient method."" The act also will outlaw advocating gay rights to minors. California Attorney General Kamala Harris claimed that the proposal was unconstitutional and it had no place in civil society. The proposal reminds me the Inquisition. We live in a free and tolerate country! So even talks about such an initiative should be immediately stopped. Where is our President? Stop considering gays as naughty and not like all the others. We are all equal. Despite all the arguments that the opponents of gay marriage call, polls show that the majority of Americans stand for gay marriages. Why not to hold a referendum as the Irish did? Why we should listen to conservatives?",https://www.facebook.com/LGBT-United-839497472793277/,United States,18 - 65+,NA,NA,NA,News Feed on desktop computers or News Feed on mobile  News Feed on desktop computers or News Feed on mobile devices," People who like LGBT United, Friends of connections: Friends of people who are connected to LGBT United",NA,NA,74,"1,038",400.00 RUB,06/25/15 04:17:19 AM PDT,06/26/15 04:17:19 AM PDT
2015-06/P(1)0002592.pdf,666,39,645,269.87,4.94,2015-06-25,2015-06-26,"Transgender employees will get health coverage On Tuesday the federal government ordered health insurers to include transition-related health coverage for transgender employees in their plans. ""Effective January 1, 2016, no carrier participating in the Federal Employees Health Benefits Program may have a general exclusion of services, drugs or supplies related to gender transition or `sex transformations,""' the new ""carrier letter"" said. LGBT advocates who have been pressing the administration for change welcomed the news. ""With today's announcement, transgender federal employees can now access health care that is so fundamental to their well- being and, in the long-term, will make transgender employees happier and more productive workers,"" National Center for Transgender Equality Executive Director Mara Keisling told. Yeah, it is really happy news for transgender people! Now the discrimination on coverage for trans people will be ended.",https://www.facebook.com/LGBT-United-839497472793277/,United States,18 - 65+,NA,NA,NA,News Feed on desktop computers or News Feed on mobile  News Feed on desktop computers or News Feed on mobile devices," People who like LGBT United, Friends of connections: Friends of people who are connected to LGBT United",NA,NA,39,645,269.87 RUB,06/25/15 04:26:40 AM PDT,06/26/15 04:26:40 AM PDT
2015-q3/2015-07/P(1)0002438.pdf,558,0,0,0,0,2015-07-01,NA,"We can't all be Presidents, but we can all be patriots.",https://www.facebook.com/patriototus,United States,18 - 65+,NA,Exclude people who like Being Patriotic,NA,News Feed on desktop computers or News Feed on mobile  News Feed on desktop computers or News Feed on mobile devices,NA,Independence or Patriotism,NA,0,0,None,07/01/15 02:24:19 AM PDT,NA
2015-q3/2015-07/P(1)0002440.pdf,559,0,0,0,0,2015-07-01,NA,The most patriotic page you've seen!,https://www.facebook.com/patriototus,United States,18 - 65+,NA,Exclude people who like Being Patriotic,NA,"on pages: Right column on desktop computers, News  on pages: Right column on desktop computers, News desktop computers, News Feed on mobile devices or Third-party Websites on mobile devices",NA,Independence or Patriotism,NA,0,0,None,07/01/15 02:23:25 AM PDT,NA
2015-q3/2015-07/P(1)0002442.pdf,560,0,0,0,0,2015-07-01,NA,The most patriotic page you've seen!,https://www.facebook.com/patriototus,United States,18 - 65+,NA,Exclude people who like,NA,News Feed on desktop computers or  News Feed on desktop computers or devices,NA,Independence or Patriotism,NA,0,0,None,07/01/15 02:23:49 AM PDT,NA
2015-q3/2015-07/P(1)0002478.pdf,585,1252,11857,5538.24,99.85,2015-07-01,NA,We speak for all fellow members of LGBT community across the nation.,https://www.facebook.com/Igbtun/,United States,18 - 65+,NA,Exclude people who like LGBT United,English (UK)or English (US),News Feed on desktop computers or News Feed on mobile  News Feed on desktop computers or News Feed on mobile devices,NA,"Motherhood, Philosophy, LGBT community, Indiana, Homosexuality, Love, Society, Fitness and wellness, Family or Photography",NA,"1,252","11,857","5,538.24 RUB",07/01/15 02:55:07 AM PDT,NA
2015-q3/2015-07/P(1)0002152.pdf,362,0,0,0,0,2015-07-02,NA,Keeping eye on our brother's cases and much more,https://www.facebook.com/blackmattersus/,United States: Atlanta (+20 km) Georgia; Baltimore (+20 km) Maryland; St. Louis(+50 km) Missouri; Richmond (+20 km) Virginia,18 - 65+,NA,Exclude people who like Black Matters,English (UK)or English (US),News Feed on desktop computers or News Feed on mobile  News Feed on desktop computers or News Feed on mobile devices,NA,NA,NA,0,0,None,07/02/15 03:10:36 AM PDT,NA
2015-q3/2015-07/P(1)0002158.pdf,365,547,13502,3544.99,63.87,2015-07-02,NA,Keeping eye on our brother's cases and much more,https://www.facebook.com/blackmattersus/,United States: Atlanta (+20 km) Georgia; Baltimore (+20 km) Maryland; St. Louis(+50 km) Missouri; Richmond (+20 km) Virginia,18 - 65+,NA,Exclude people who like Black Matters,English (UK)or English (US),News Feed on desktop computers or News Feed on mobile  News Feed on desktop computers or News Feed on mobile devices,NA,NA,NA,547,"13,502","3,544.99 RUB",07/02/15 03:10:36 AM PDT,NA
2015-q3/2015-07/P(1)0002162.pdf,367,0,0,0,0,2015-07-02,NA,Keeping eye on our brother's cases and much more,https://www.facebook.com/Black-Matters-1579673598947501/,United States: Atlanta (+20 km) Georgia; Baltimore (+20 km) Maryland; St. Louis(+50 km) Missouri; Richmond (+20 km) Virginia,18 - 65+,NA,Exclude people who like Black Matters,English (UK)or English (US),News Feed on desktop computers or News Feed on mobile  News Feed on desktop computers or News Feed on mobile devices,NA,NA,NA,0,0,None,07/02/15 03:10:36 AM PDT,NA
2015-q3/2015-07/P(1)0002168.pdf,370,177,3716,1294.75,23.33,2015-07-02,NA,Join us because we care. Black matters.,https://www.facebook.com/Black-Matters-1579673598947501/,United States: Atlanta (+20 km) Georgia; Baltimore (+20 km) Maryland; St. Louis(+50 km) Missouri; Richmond (+20 km) Virginia,18 - 65+,NA,Exclude people who like Black Matters,English (UK)or English (US),News Feed on desktop computers or News Feed on mobile  News Feed on desktop computers or News Feed on mobile devices,NA,NA,NA,177,"3,716","1,294.75 RUB",07/02/15 03:10:36 AM PDT,NA
2015-q3/2015-07/P(1)0002174.pdf,373,71,1343,440.12,7.93,2015-07-02,NA,Join us because we care. Black matters.,https://www.facebook.com/Black-Matters-1579673598947501/,United States: Atlanta (+20 km) Georgia; Baltimore (+20 km) Maryland; St. Louis(+50 km) Missouri; Richmond (+20 km) Virginia,18 - 65+,NA,Exclude people who like Black Matters,English (UK)or English (US),News Feed on desktop computers or News Feed on mobile  News Feed on desktop computers or News Feed on mobile devices,NA,NA,NA,71,"1,343",440.12 RUB,07/02/15 03:10:36 AM PDT,NA
2015-q3/2015-07/P(1)0002176.pdf,375,0,0,0,0,2015-07-02,NA,Join us because we care. Black matters.,https://www.facebook.com/Black-Matters-1579673598947501/,United States: Atlanta (+20 km) Georgia; Baltimore (+20 km) Maryland; St. Louis(+50 km) Missouri; Richmond (+20 km) Virginia,18 - 65+,NA,Exclude people who like Black Matters,English (UK)or English (US),News Feed on desktop computers or News Feed on mobile  News Feed on desktop computers or News Feed on mobile devices,NA,NA,NA,0,0,None,07/02/15 03:10:36 AM PDT,NA
2015-q3/2015-07/P(1)0002182.pdf,378,0,0,0,0,2015-07-02,NA,Your life matter.My life matter. Black matters.,https://www.facebook.com/Black-Matters-1579673598947501/,United States: Atlanta (+20 km) Georgia; Baltimore (+20 km) Maryland; St. Louis(+50 km) Missouri; Richmond (+20 km) Virginia,18 - 65+,NA,Exclude people who like Black Matters,English (UK)or English (US),News Feed on desktop computers or News Feed on mobile  News Feed on desktop computers or News Feed on mobile devices,NA,NA,NA,0,0,None,07/02/15 03:10:36 AM PDT,NA
2015-q3/2015-07/P(1)0002188.pdf,381,0,0,0,0,2015-07-02,NA,Your life matter.My life matter. Black matters.,https://www.facebook.com/Black-Matters-1579673598947501/,United States: Atlanta (+20 km) Georgia; Baltimore (+20 km) Maryland; St. Louis(+50 km) Missouri; Richmond (+20 km) Virginia,18 - 65+,NA,Exclude people who like Black Matters,English (UK)or English (US),News Feed on desktop computers or News Feed on mobile  News Feed on desktop computers or News Feed on mobile devices,NA,NA,NA,0,0,None,07/02/15 03:10:36 AM PDT,NA
